<?xml version="1.0" encoding="UTF-8"?>
<!DOCTYPE examen SYSTEM "../xml/exo6.dtd">
<examen code_cours="115">
<classe>3eme</classe><matiere>Math</matiere><prof><nom>Diagne</nom><prenom>Sira</prenom></prof><date annee="2022" mois="Juillet">2022-07-29</date><Exercice><description>L ,   O ,   U  sont trois points non alignés du plan.  S  est le milieu du segment  [ O U ] .</description><question>Construis le point I tel que : →LI=→LO+→LU</question><question>Démontre que :  →LO+→LU=2→LS&#13;
</question></Exercice><Exercice><description>Soit  R S U  un triangle rectangle en  U  tel que  R S = 3   et  S U = 2</description><question> ABC est  un triangle rectangle en A tel que ˆABC=56o et BC=4.2cm. Calculer AB et  AC</question><question>Construire un triangle OIE rectangle en O tel que ˆOEI=72o et OE=2cm. Calculer l'arrondi au dixième près de OI et vérifier sur la figure.</question></Exercice><Exercice><description>A B C D   est un trapèze de bases  ( A B )  et  ( D C )  ;  A B = 3 c m ;   B C = 4 c m ;   D C = 5 c m  et  ˆ B C D = 60 ∘ .   La parallèle à  ( B C )  passant par  A  coupe  ( B D )  en  I  et  ( D C )  en  M .</description><question> Faire la figure.</question><question>Quelle est la nature du quadrilatère ABCM ? En déduire MC puis AI.</question><question>Soit P un point de [BC] tel que PC=2.4. Montrer que les droites (MP) et (DB)sont parallèles.</question></Exercice><Exercice><description>Voici les tailles en cm des vingt élèves d'une classe de 3iéme. 165 145 150 166 165 160 158 162 165 150 158 165 154 158 160 162 162 154 165 160</description><question> a) Quelle est la population étudiée ? &#13;
 &#13;
b) Quelle est le caractère étudié ? Puis donner sa nature.</question><question>Dresser le tableau des : Effectifs ; ECC ; ECD ; Fréquences ; FCC et FCD en %&#13;
.</question><question>a) Combien d'élèves ont au plus 158cm?&#13;
&#13;
 b) Combien d'élèves ont plus de 158cm ?</question><question>a) Quel est le mode de cette série ? Donner sa signification.&#13;
 &#13;
b) Calculer la taille moyenne de cette série. Donner sa signification.</question></Exercice><Exercice><description>exercice</description><question>question</question></Exercice><Exercice><description>exercice</description><question>question</question></Exercice><Exercice><description>exercice</description><question>question</question></Exercice><Exercice><description>exercice</description><question>question</question></Exercice><Exercice><description>exercice</description><question>question</question></Exercice><Exercice><description>exercice</description><question>question</question></Exercice></examen>
