<?xml version="1.0" encoding="UTF-8"?>
<!DOCTYPE examen SYSTEM "../xml/exo6.dtd">
<examen code_cours="info 114">
<classe>dic3</classe><matiere>XML</matiere><prof><nom>Camara</nom><prenom>Ibrahima</prenom></prof><date annee="2022" mois="Juillet">2022-07-27</date><Exercice><description>exercice</description><question>question numero un</question><question>question numero deux</question><question>question numero 3</question></Exercice><Exercice><description>exercice</description><question>question numero un</question><question>question numero deux</question></Exercice><Exercice><description/><question>question numero un</question><question>question numero deux</question></Exercice><Exercice><description/><question>question numero un</question></Exercice><Exercice><description/><question/></Exercice><Exercice><description/><question/></Exercice><Exercice><description/><question/></Exercice><Exercice><description/><question/></Exercice><Exercice><description/><question/></Exercice><Exercice><description/><question/></Exercice></examen>
