<?xml version="1.0" encoding="UTF-8"?>
<!DOCTYPE examen SYSTEM "../xml/exo6.dtd">
<examen code_cours="info 114">
<classe>dic3</classe><matiere>IA</matiere><prof><nom>Camara</nom><prenom>Mamadou Samba</prenom></prof><date annee="2022" mois="Juillet">2022-07-27</date><Exercice><description>exercice</description><question>(#PCDATA)(#PCDATA)(#PCDATA)</question></Exercice><Exercice><description>exercice</description><question>(#PCDATA)(#PCDATA)(#PCDATA)</question><question>(#PCDATA)(#PCDATA)(#PCDATA)</question><question>(#PCDATA)(#PCDATA)(#PCDATA)</question></Exercice><Exercice><description>exercice</description><question>(#PCDATA)(#PCDATA)(#PCDATA)</question><question>(#PCDATA)(#PCDATA)(#PCDATA)</question></Exercice><Exercice><description/><question/></Exercice><Exercice><description/><question/></Exercice><Exercice><description/><question/></Exercice><Exercice><description/><question/></Exercice><Exercice><description/><question/></Exercice><Exercice><description/><question/></Exercice><Exercice><description/><question/></Exercice></examen>
