<?xml version="1.0" encoding="UTF-8"?>
<!DOCTYPE examen SYSTEM "../xml/exo6.dtd">
<examen code_cours="info 112">
<classe>dic2</classe><matiere>XML</matiere><prof><nom>Fall</nom><prenom>Ibrahima</prenom></prof><date annee="2022" mois="Juillet">2022-07-25</date><Exercice><description>exercice</description><question>ceci est la question numero 1</question><question>ceci est la question numero 2</question><question>ceci est la question numero 3</question></Exercice><Exercice><description>exercice</description><question>ceci est la question numero 1</question><question>ceci est la question numero 2</question></Exercice><Exercice><description>exercice</description><question>ceci est la question numero 1</question></Exercice><Exercice><description>exercice</description><question>ceci est la question numero 1</question></Exercice><Exercice><description/><question>ceci est la question numero 1</question></Exercice><Exercice><description/><question>ceci est la question numero 1</question></Exercice><Exercice><description/><question>ceci est la question numero 1</question></Exercice><Exercice><description/><question>ceci est la question numero 1</question></Exercice><Exercice><description/><question>ceci est la question numero 1</question></Exercice><Exercice><description/><question>ceci est la question numero 1</question></Exercice></examen>
